imdb_id,review,rating,genres
tt26770113,"The show presents a unique take on the familiar zombie theme, distinguishing itself from other similar shows through several features. One of the most notable aspects is the casual tone that pervades the series. This relaxed atmosphere is accentuated by clever humour, using witty jokes and humorous situations to provide comic relief and lighten the mood.However, there are areas where the show could improve. Pacing is one such issue. Specific episodes feel drawn out, leading to potential disengagement from the audience. Examining its narrative structure could help identify and adjust any uneven sections for improved pacing. Another area of concern is the use of clichéd elements. Some parts of the show can seem clichéd or overused, which reduces its distinctiveness.In conclusion, the show, while offering a fresh perspective on the zombie genre through its casual tone and humour, has areas that could benefit from refinement. By addressing these concerns, it could elevate its appeal to the audience.",neutral,"Comedy, Game-Show, Horror"
tt26770113,"Some people leaving negative review here saying it was scripted, lol did you really watched the show?? If i am part of the show i would definitely scream too!!!!! I feel like i am running together the characters escaping zombies especially, the ep3 and 4. Yeah they knew from the start its fake, but the setting and acting skills of the zombies makes you also feel like you were in a real zombie world. Imagine, there are different scary places that the challenger needs to survive. I also love that the characters have different personality. We need to know who's gonna win! Please give us season 2!!!! Dex and Tsuki my bet!✊🏻✊🏻✊🏻Please give us season 2!!!! Dex and Tsuki my bet!✊🏻✊🏻✊🏻",positive,"Comedy, Game-Show, Horror"
tt26770113,"This is not a survival show, it's a quirky funny scarefest! A lot of people probably didn't get to the end, I almost stopped watching when I saw the low ratinf as I watched through the 2nd episode, it got so much better and I'm glad I finished it! Hope you enjoy it as much as I did, think it deserve a much higher rating than this.Started watching it thinking it'll be a serious ""how to survive the apocalypse"" type of thing. Only to find that it was the complete opposite of that! Has to adjust in the first couple of episode to get my expectations right. Then I began to enjoy its quirkiness, one of a kind, funny gameshow. Some of the characters was annoying to begin with but everything ties in together for the finale!This is clearly a comical Korean reality TV show especially with guests like Nara, Din Din and Hong Chul. It's not suppose to be your survivalist cast! Enjoy the silliness with a bit of a thrill and intensity. Loosen up for this show, don't watch it like you're watching the Walking Dead.",positive,"Comedy, Game-Show, Horror"
tt26770113,"Oh man, what a brilliant idea!Firstly, let's make something clear: ""Zombieverse"" is very, very, very different from any other zombie media you've likely seen. It's meant to be a ""reality"" show, meaning the content is unscripted. Just like how improv comedy shows have a much different feel to them than scripted comedy standup shows, the same rings true here.The biggest issue most people will encounter is the lack of emersion for the viewer. They did what they could to help with this -- e.g., it appears they intentionally avoided closeups and instead stuck to primarily wide-angle views. When interesting things happen, it seems like they do some clever editing to make it feel more real to the viewer. At times, it's possible they even recreated events that took place if they didn't play out well on camera.Still, while the actors are in character, they do let reality bleed through. This is, however, intentional. Without this, the idea wouldn't work.In essence, what I mean by that is that you can tell something about the acting is ""off"", in addition to the unscripted nature of the show. For one, if you see a zombie in real life and decide to hit it over the head with something to kill it, you're not going to hold back. They know the zombies are all also actors, so they are very limited in the actions they can take. This is why there is a lot of grabbing, pushing, and pulling and less actual violence. The lack of lethal actions against the zombies creates a subconscious breaking of emersion for the viewer.Overall, however, the show does what it's supposed to. Rather than watching a fantasy/horror TV show about zombies, the show becomes far more entertaining when you instead view it more as a game show. To win, they not only have to beat the game (not turn into a zombie), but also stay in character. Breaking character would inevitably result in a loss for the contestant. With this perspective, it's honestly brilliant and incredibly entertaining.In addition, many of the reactions are genuine, especially when it comes to jump scares. While there isn't any real ""fear"" in the sense of ""I'm afraid of being eaten by a zombie"", jump scares are still just as scary as a friend hiding behind a door to jump out and scare you. There's no danger, but the reaction is still fully real.The humor is also incredible as the contestants let reality ""leak through"", as I mentioned before. This makes it clear that they aren't trying to ""trick"" the viewer into feeling like they're encountering real zombies, which would be a bit of an insult to the viewer. That's not the goal, however, hence the unrealistic humorous moments are frequent and 100% natural. Given that many contestants are known comedians, this was very clearly intentional, and a brilliant idea.Also, I feel like a lot of non-native reviewers are basing their reviews on the English dub. I haven't watched Zombieverse with subs and original audio, but in almost all cases (especially with live action), they have to balance lip syncing with logical and fluid sentences. They tend to prioritize good lip syncing, meaning sometimes sentence structures can feel unnatural. This is a side-effect of dubbing that will exist until AI is used to automatically change the lip movements of the characters (not generate the actual voice acting, however; we want to keep that industry human for as long as we can).In any case, don't let the low score fool you: for what the show is trying to do, it is incredibly well done.",positive,"Comedy, Game-Show, Horror"
tt26770113,"The first few episodes were not that great, but the second half had me in stitches.The premise of the show isn't that good, but there are laughs aplenty.When the people break character and start laughing, it's infectious. Even a ""zombie"" or two break character as well.Noh Hong-chul is a wimpy, scaredy-cat. (Think far left in US) and he only thinks of himself, but he's really funny. His scenes with the undercover reporter is hilarious and a highlight.I'm almost certain thatJonathan breaks character the most. .Park Na-rae is sassy and her teaming up with fellow half zombie Hong Seong-woo was a perfect match.So, if you stopped watching after the first few episodes (like I did). Go back and finish(like I did)It gets better soon. It gets a lot better.",neutral,"Comedy, Game-Show, Horror"
tt26770113,"It's actually really funny and intense. The chemistry between the members are great and especially DEX like he is such a fighter we love him. Of course the places they go are scripted like the locations they go to however what happens there is 100% their own reaction and you can see that. Like who survives and becomes a zombie is not chosen it's actually real and you can know this by their interviews. I was so immersed into the show, I was rooting for the casts, I had to stop in the middle cause it was nerve wrecking. If you want a humorous, stress relieving, and a quick show to spend time - this is it.",positive,"Comedy, Game-Show, Horror"
tt26770113,"It can't be easy to come up with any new ideas in the Zombie genre these days as it has been done to death (pun intended) for decades now.Zombieverse is a new take that I haven't seen before.I imagine it's probably a lot more scripted than it looks (and could well be just 100% scripted) but it comes across as a tongue-in-cheek, semi-reality, drama, comedy, skit-show, horror. Yes, it's quite difficult to define.They got a group of famous Sth Korean celebrities, most of which are comfortable in front of the camera and some obviously aren't which clever editing has hidden as much as possible, and dumped them into this psuedo-realistic zombie gameshow where from their natural reactions we are supposed to believe that they aren't ""acting"" but are actually experiencing a zombie apocalypse.Think Schwarzenegger's The Running Man mixed with Celebrity Survivor but with a strong comedic bent and with all the bloopers left in and you might get sort of a feel what this series is like.It sounds like a train wreck I know but they actually make most of it work. Not all as some parts fall flat but most.I'm sure there is quite a bit of improv which mostly works and is very funny when it does.I noticed a lot of reviewers stopped watching early and gave it scathing reviews. This is kind of understandable as you have to be in the right mood and watch a few episodes to get in the right mindset but it's worth it in the end.I could write a lot more about the complexities of the show but this is enough already. I recommend it.",positive,"Comedy, Game-Show, Horror"
tt26770113,The show was so mazing and sooo hilarious. I love the idea and everything is so well thought of and executed. But I have to say this.... PATRICIA WHAT THE HELL... pls stop. I have never seen a more useless contestant in my life!!! She was never helpful with anything and such a liability! She should've gotten out like her brother. The show was already a bit sexist in the way men treated women as kind of incapable little things - thank God subleader was a badass - but Patricia just perpetuated this image unfortunately. She didn't even try! If you can't move or be helpful with anything why are you even there. Even Hong Chul contributed to the group somehow if nothing then as a provider of comic relief. Man.... I loved the show but Patricia really pissed me off.,positive,"Comedy, Game-Show, Horror"
tt26770113,"Give this a chance as it's really a fun and silly show, and super entertaining.First, realize it's not meant to be serious or taken seriously. This is a bunch of South Korean actors and celebs and tv stars and they are, in essence, playing a game. They are cosplaying a zombie outbreak and it's so fun and immersive. They are supposed to filming another reality show, and then a zombie outbreak happens, and they are stuck in it. They move from place to place trying to solve challenges, figure out what the zombies respond to, get certain items, escape and not be bitten. The sets are really well done and SUPER fun--they are actually driving cars, going from place to place, etc. (though in reality more likely set to set), and it actually looks so fun to be in this immersive environment.The actors are playing themselves, but committing for the most part to the ""zombie outbreak"" environment, but they do break character from time to time laughing at the silliness, making jokes, etc. But they do get into solving the problems and puzzles, and figure out the next step. And what happens if someone does get bitten? You'll have to watch to find out. It's honestly so fun, though it IS silly as hell. Suspend your hopes for something serious and just get into how great they set up a type of game show and all the sets and costumes and effects. The ""characters"" are really fun and get into it, and there's some good laughs along the way.",neutral,"Comedy, Game-Show, Horror"
tt26770113,"My understanding is these are all a bunch of B list celebrities that came together and were told, you're all going to take part in a LARPing show about the zombie apocalypse. They're all told to play it out as realistically as possible but it's apparent, that folks can't help but break character depending on the situation they find themselves in. Once a cast member has been ""bitten"" they are given a wound and a timeline as to how long they have until they become full zombies. Ultimately you want to avoid getting bitten but they're all aware it's a possibility. I myself think this is AMAZING! It's such a creative take on reality tv. Live action role play meets games how. Also the actors they have supporting are so good at improvising throughout. This really is a diamond in the rough if you give it a chance.",positive,"Comedy, Game-Show, Horror"
tt26770113,"At first, I was hesitant. I didn't know what to think. I didn't even knew what I was watching. But I hung in there and by the time I reached episode 7 I was laughing the entire time. Its so incredibly funny because a lot of 'zombies' break character and started acting 'human'. The pirateship for example. It was hilarious. Especially these two half-zombies. Dex and Jin Young with their potato gun was funny too and don't get me started on the DinDin scene with Yoo Hee-kwan. Once you'll look at it from a comedy point of view, it's actually very entertaining. Don't watch this show as if it's The Walking Dead and don't think about every little detail to much. It's been a long time since I have laughed this much. Credits to the cast and creators.",positive,"Comedy, Game-Show, Horror"
tt26770113,"You have to hand it to the Koreans for coming up with entertaining programming. This imaginary zombie infestation was fun, silly, gross and contains plenty of edge-of-your-seat action as each task takes a toll on the struggling contestants. Unexpected kinship develops and each time one of the cast loses it and cracks up laughing, the viewer laughs right along with them. It's the most fun I've had on Netflix in a long time. Standing out in the mix are the beautiful Lee Si-Young and the lanky Kim Jin-Young (Dex) a deceptively laid back ex-soldier who runs circles around the zombies and bravely risks his skin to save others not once but several times. Unscripted has never been my cup of tea, but I loved this and can't wait for a second season.",positive,"Comedy, Game-Show, Horror"
tt26770113,"This is an absolutely amazing show. It's got zombies, it's got comedy, it's reality tv. It's all my favourite things thrown together. I don't understand why it's got such bad reviews. It's a game show, people. It's very similar in premise to the BBC3 show I Survived a Zombie Apocalypse that aired in 2012/2013.It's got a good mix of people, all Korean celebrities, having to make decisions about how to survive. They can choose to work in a team, or betray their team members and save themselves. Sure, some of the characters are a little annoying, but it gets you to root for the characters you love.People should take it for what it is: a bit of fun.",positive,"Comedy, Game-Show, Horror"
tt26770113,"I really like zombieverse becus it shows the different skills and persona of the cast, it also shows there teamwork or maybe-not and more. Good acting skills especially the zombiess and fun fact there is a lesson you can learned! There are times you can be really into character like you are in that show hehe like you can feel enjoy, suspense, annoyed, and more. I REALLY RECOMMEND THIS SHOW! ALL CAST ARE MY FAVS BUT MAIN WOULD BE DEX!!! HE IS STRATEGIC, WILL PROTECT AND SACRIFICE AND HAVE GOOD LEADERSHIP😍😍😍IF YOU ARE CURIOUS TO KNOW SOME!! GO WATCH IT, AND ENJOY I LIKE IT REALLY NO JOKE!! FIGHTING!!! LOVE IT!!!! THERE ARE TIME YOU WILL FEEL SAD BECUS OF WHAT WILL HAPPEN BUT I ASSURE ITS WORTH, FOR MY OPINION! I LIKE THIS SHOW! SOME CAN BE ANNOYED, SOME CAN BE GOOD! I RECENTLY JUST FINISHED THIS SHOW!!! IT INSPIRES ME TO LEARN NEW SKILLS LIKE 🤔 its secret! It also has some ACTION SKILLS! EMS THERE ARE MOMENTS YOU WILL ASK ""WHAT ARE WE"" 😆😍BUT GOOD TO KNOW I ENJOYED IT! WITH MY FRIENDS! YOU CAN ENJOY IT WITH YOUR FRAM, FRIENDS OR OTHERS OR MAYBE ALONE! THERE ARE TIMES A MOMENT WOULD BE LACKING BUT AFTER, IT WILL JUST GO ON AND MOVE ON! SO ALL GOOD AND THERE ARE SOME TWIST MOVES😍😍if you want to watch go watch! REMEMBER THIS IS MY REVIEW!",positive,"Comedy, Game-Show, Horror"
tt26770113,"Whether this was meant to be funny or not, I have never laughed so hard at a tv show. Don't watch it expecting to take it seriously, especially when the contestants don't take it seriously themselves. The candid laughter and embarrassment they had really made this show hilarious.I commend the makeup and sfx artists for their gory zombie looks - for such a satirical tv show it was done to a really high standard.As a huge lover of anything zombie related, I would recommend giving this a watch.I have never hated a character as much as Patricia - she hindered the group massively and I would have cut her off at the very start.",neutral,"Comedy, Game-Show, Horror"
tt26770113,"Just because you misunderstand the concept of this show doesn't mean it's awful. This reality GAME show is so hilarious and original. I was crying laughing during every episode. It is a game show, where the contestants have to survive a zombie apocalypse scenario. They all know this is a game show, and the zombies are actors. I have seen reviews complaining about no violence, cursing, or nudity. Well it's a reality game show they can't injure the other people even if they are playing zombies. It's unscripted in the sense that the contestants don't know what each stage will consist of and they are all doing their best to not get infected and lose the game. I think the 1 star reviews are unwarranted and it's a shame that they dragged down the rating when it was really enjoyable to watch.",positive,"Comedy, Game-Show, Horror"
tt26770113,"The show was so freaking out of this world! It has great characters, amazing plot, bomb sfx and makeup. It's also hilarious! So whoever doesn't like this show hold this L because you have no imagination whatsoever. The amount of effort that went into this show was extremely impressive! You will never beat a reality show like this. And this show is literally so hilarious! I also loved how they did the zombies makeup. Looks so real! And I was laughing my butt off the whole show because it's so funny and unhinged. Again if you don't like this show we don't care go back to watching the boring bachelor or whatever. Hopefully they make a s2 of zombieverse! Great job to the whole cast and crew!",positive,"Comedy, Game-Show, Horror"
tt26770113,"Never thought a zombie series can be this comedic!! People who love seriousness in every series they can't even understand this ! I love their dialogues, their gesture, and the zombies are actually funny too ! It was very different from other series , impressive the characters were actually clueless as if it was real ! In every series the characters always holds weapons but in this series they fought barehand maximum times! All I like is their chemistry, it was really funny alot ! All of are dead and kingdom is other genres of zombie , don't compare this series with those series! U will love..",positive,"Comedy, Game-Show, Horror"
tt26770113,"This reality show, set against the backdrop of a survival game, offers an absolute rollercoaster of entertainment for its audience.With a perfect blend of genuine laughter, heart-racing suspense, and a storyline that could outshine many of the blockbuster movies centered around zombie narratives, it delivers an experience that keeps viewers on the edge of their seats.The show's compelling plot and the intense challenges woven through each episode make it a standout, offering an immersive experience that's as thrilling, if not more, than the best zombie-themed films out there.One of the best realty show!",positive,"Comedy, Game-Show, Horror"
tt31038436,"Top 5 the worst netflix or even korean variety show i've ever watched, the writer and producer messed up with this one. I cant believe netflix korea produced such a confusing, jumbled, and boring show. The storyline is all over the place, all that big anniversary / event / show / birthday party packed into 2-4 mins soulless scene with no intention, its like watching a bunch of videos put together randomly.I give it 5 stars because its still fun watching David, Teo, and Se-Ho as the main host. David and Se-Ho should meet each other!It would be interesting if the host can join the cast living their daily life, not just reacting from a single room for 6 episodes straight hahaha.",neutral,Reality-TV
tt31038436,"It appears that to some people, viewing the idiosyncracies of the super rich is somehow entertaining. It is hard to fathom how anyone thinks this, especially with excuciatingly vapid and superficial shows like this.They are bad enough in the west. But when you factor in the inanity, peurility, and vacousness you get when the three presenters appear to want to intend it for an audience of three year olds, it reaches a new low.The fact is, 'rich' people (most of whom have become wealthy because of some annoying quirk of fate anyway) seldom have anything interesting in their lives. The only thing they offer is their narcissism and self absorption.If that's your thing, knock yourself out.This show is the intellectual equivalent of staring at paint drying.",negative,Reality-TV
tt31038436,"There's literally nothing going on here. All that you'll be watching is five rich people try to be interesting and three hosts try to make the rich people interesting. There's no direction in this series, the entire season could be summarised in a single 30 minute episode.They are beautiful and they have money but that's about it. No hobbies no...I don't even know.Double blind dates, anniversary parties, birthday parties, house tours, and house and clothing shopping. So so many things happening and yet nothing at the same time.Theo and the David carried this show as much as they could, I'll give them their credit because without them it would've been...yea.",negative,Reality-TV
tt31038436,"This is the worst & most shallow Korean reality show I've watched and I can't finish it. There's nothing worth watching. I was just curious to see what it was but all I saw were very materialistic people who are obsessed with self indulgence. These people have to learn the difference between freedom and self indulgence. Saying that dresses are more important than your own life? You should get yourself a doctor. You can afford psychiatric help anyway. Although Im not sure there's a cure to the highest level of materialism and self indulgence. There is nothing wrong with being super rich but how you use that wealth says everything about your moral and values. The only person there who is worth watching is Noor Naim. Her story is inspiring because she went from nothing to having everything she ever wanted. That is a true story of success. The rest were born with a silver spoon, which of course isnt wrong and just a good stroke of fate but helloooo...one thinks clothes are more important than life, one is acting like a good friend and is nice to everyone but actually has a sleek personality and knows what he is doing. He wants to steal the limelight from his friend because he knows he looks better than him and he wants more air time. I think he is the worst friend to have. One that acts all nice and perfect but actually just doesnt want anyone to take his shine. I swear I was so annoyed at his friend at first because he was overconfident about his looks and his outfits are too flashy but after that blind date where his friend had to come along even if he shouldnt have, I felt so bad for him. If anything, he might be the most annoying super rich person at first, but as you continue to watch him he is the most genuine of all the characters in that show aside from Noor. Because he knows what he wants, he dresses how he wants and doesnt take other people's opinion just to be nice. The hosts shouldnt be there. All three of you deserve a show that has more depth and meaning.",negative,Reality-TV
tt31038436,"What is the point in having three people comment on every 4th-6th scene? All they do is point out the obvious and say wow every single time? Completely annoying and no point... this should be called a reaction video of the super rich in korea. I had to stop watching after 4 minutes into it. If there was a way to mute their nonsense noise making then maybe i would have watched this a bit longer. All they do repeat the scene, ""look at the bag"", ""look at the room"", ""wow"", ""wow"", ""wow"", ""they are going into the room"", ""wow"", ""what?"", ""wow"", ""wow"", ""wow"", ""wow"", ""wow"". You can understand the amount of ""wow"" and the entire 4 minutes into, i am trying to understand why they are even there.. do they need to be there to help explain how rich these people are? Are they trying to invoke me agree with their ""wows""?",negative,Reality-TV
tt31038436,"No direction , not happening quite boring and can be shorten much much more. Their life looks boring to me also nothing big or surprising happening there , the crazy rich asians video from youtube had more dept and stuff going on . The series had no specific direction. Also the crazy rich people dont have strong personality . I know they are rich etc but do they bring dept and character to the drama? They did nothing except fashion and buying stuff its boring. Also most of them doesnt look attractive nough to carry a series , its quite anooying to keep watching them , overall its not super bad but it sould be better.",negative,Reality-TV
