imdb_id,review,rating,genres
tt14482414,"Not many will like the show for its portrayal of badminton or the way players are trained but, i dont know how badminton is played or how unrealistic the show is, what i really liked about the show is how simple and real this show is about the struggle of youth, so far i have watched 10 episodes and i have come to the conclusion that more than badminton this show is about slice of life, for instance, Yoon Hae Kang cannot play baseball because his father couldnt pay the fee on time, parents who temselves have gone through rough time in their youth and dont want their kids to go throught the same, Jung In Sol father wants his son to follow in his footsteps, na un-chan family doesnt support him, these are some of the many realities that make this show worth the watch and dont forget the villager's who try their best to help each other, please dont judge the show based on how unrealistic the badminton is portrayed just think of this show as a slice of life and you wold be surprise to know how good the show is, i have loved all the episodes so far, give it a chance and you will love it too.",neutral,"Comedy, Drama, Sport"
tt14482414,This is one of my fav teenage sports series .. all the casts and crew did a great job.. it was good to see all the players were actually teenagers.. the series portrayed love for sports as well as friendship and bond between the coach and teammates and also with the people around like villagers.. respect for all the athletes as well .. waiting for the final episode.,positive,"Comedy, Drama, Sport"
tt14482414,"Despite the blunder in episode 5, I really think the rest of the drama is heartwarming and plays into the friendship and family dynamics. Love it!",positive,"Comedy, Drama, Sport"
tt14482414,"First of all i should congragualate the whole team the directer,the script writer,the artists everybody who worked on this drama. In a simple word its a healing drama.this drama really need more attention.they are so cute and fun filled people..i felt like i need a squad like them..i neee a parents like them..this drama proved that not all the sports dramas are boring ..it proved that this is unique..there are so many people who are giving low ratings for this series for the particular scene its not fair..even though its a disrespectful scene you should not blame the whole season..if someone didnt watch this drama..or stopped this at the beginning they will really miss this masterpiece.",positive,"Comedy, Drama, Sport"
tt14482414,"When I first watched this, I felt it would be my forever favorite film that no film could be made in place of it. It's an amazing film, every moment, every single one that doesn't mean that much. Please don't destroy a film that's worth more fame than it's ever been, and should indeed be known for its support.",positive,"Comedy, Drama, Sport"
tt14482414,This drama has a different story and its like a refreshing one. The actors are great well adopted to the drama. It's a must watch if u want something new and cool.,positive,"Comedy, Drama, Sport"
tt14482414,"So many people left a bad ratings.I started to hesitate to watch but I watched it and it's a good one.Despite of every rumors that circulate we should appreciate the actors, the crew, the director, and all production team that try to make a good series.Seriously guys don't drop a hateful comments if you only watch 5 eps.",positive,"Comedy, Drama, Sport"
tt14482414,"I am enjoying this drama very much. I wait every Monday and Tuesday to watch this drama😊😊 So much comedy, so much emotion, so much lovable character.. Drama is for entertainment purpose.. And I feel thrilled and enthusiastic after watching this drama.. Keep going RACKET BOYS👍👍",positive,"Comedy, Drama, Sport"
tt14482414,"The plot is heartwarming and emotional. The actors and actresses are practiced by professionals, they even have their own training journal. So if i don't get it when people talk bad about their skills? It is driving other attention away on a really good series.",positive,"Comedy, Drama, Sport"
tt14482414,"This drama are not actually like other dramas that people expected . Although it is lack at some part, but i really love about how the drama showed us the value of life , relationship between family and friends and also neighbours and the most important is the encourage to achieves our dreams... yeah its good to watch ...",positive,"Comedy, Drama, Sport"
tt14482414,"Although I don't know much about badminton, this drama was less about sports and more about life and people in general. There are a lot of lessons to be learnt from the drama and it covers a lot of topics such as poverty, abuse, friendship, prejudice etc...
I Love how the drama shows the positive of humanity and how good people can really be especially during difficult times, the friendship between the boys and the caring community within the village is truly admirable. It has got to be one of the best wholesome dramas out there.If you are watching it for the sports I wouldn't recommend but if you want to watch something that makes you feel appreciative and happy at the end of it with a few laughs, definitely give this a try.",positive,"Comedy, Drama, Sport"
tt14482414,"It's not perfect, but It's a beautiful story about friendship. And, like usually happens in the Korean (and in the asians dramas in general) the cast is very good. I really think this show deserves a better rating.",positive,"Comedy, Drama, Sport"
tt14482414,"This is one of the cutest family shows ive seen from korea in a while. Its funny, heartwarming, and a legitimately fun watch. There are shenanigans happening to make this show so artificially low scored.",positive,"Comedy, Drama, Sport"
tt14482414,"I really admire on how well-written this drama is. This is full of plot twists and back stories where it enticed my curiosity in every episodes. It is a slice of life, coming of age drama, which I really like. This is indeed a healing drama. I recommend it to watch with your families and friends.I'm just disappointed on how others rate this show. That is so unfair. Stop being too sensitive people. It just shows that it might really happen in real life when it comes to sports. Rating this drama low can reflect and prove that those people are really like that in real life. This just shows that these people are indeed like that in real life.",positive,"Comedy, Drama, Sport"
tt14482414,"Light-hearted, heart-warming and cute. I really enjoyed watching this drama and if you're looking for something cute and funny give this a try. Apparently it is not a realistic depiction of badminton but as someone who knows nothing of the sport, I found the badminton scenes entertaining. I don't understand why there is so many negative reviews but everyone has their own opinion and if you're still wondering if u should watch it give it a chance :)",positive,"Comedy, Drama, Sport"
tt14482414,"This is a decent light-hearted COMEDY drama, a fact most reviewers seem to have missed. It has a fun little cast with a nice amount of diverse characters with a little teen romance thrown in, well worth your time.",positive,"Comedy, Drama, Sport"
tt14482414,Funny. Good and comedic. The storyline is good.acting is great.,positive,"Comedy, Drama, Sport"
tt14482414,Been watching it since thr 1st episode on 15 now and it isn't bad. It's a very cheerful show.,positive,"Comedy, Drama, Sport"
tt14482414,It's true that there are some flaws in this series but I actually think that this is an amazing drama. I love how they make some scenes fun and adorable to watch.I really want to find a series that give off the same vibe as this.,positive,"Comedy, Drama, Sport"
tt14482414,"I'm up to Ep3 and am quite enjoying it, however they've just shown a city shot of ""Queenstown New Zealand"", only sorry people, that's AUCKLAND New Zealand. It's not even the right island! It did make me laugh though, as it's clear whoever captioned it in Korean on the screen and then subtitled it has never actually been there! My kiwi neighbours would be so sad :(This is quite enjoyable so far. I'll edit this when I'm done!",positive,"Comedy, Drama, Sport"
tt14482414,"Extremely confused by the negative reviews left here, the plot line is extremely catchy and centres around a group of kids and their sports-oriented living. The kids have done a great job at catching the essence of their characters with their acting. Anyone who has a background in badminton will be able to really enjoy the show.I'd recommend not sticking to the negative reviews (which have NOTHING to do with the acting or the badminton-centered plot as such) and giving it a chance!",neutral,"Comedy, Drama, Sport"
tt14482414,"A very cute and charming drama. As someone who's been watching western films and shows portray Soviets, Russians, Arabs, Gypsies and what not in a very bad light, I'd say the few comments in ep. 5 were nothing. A bit offensive, yes, but nothing to go crazy over. People reacting so negatively towards this can't have payed much attention to how the media portrays different nationalities and ethnicities. I.",positive,"Comedy, Drama, Sport"
tt14482414,"People who claim it's racist need to get over themselves. It's a kdrama, as in Korean show. Of course the narrative might include the focus of the Korean team's success and not about other countries.There's nothing racist about this show.Keep it light people. Your projected racism is unwarranted. Clearly you have no idea what racism is.",positive,"Comedy, Drama, Sport"
tt14482414,"I rarely right reviews unless if it is a masterpiece. This is one of the rare classic funny n very refreshing drama I've ever seen till now. This is after watching all 16 eps. It is s complete combo of comedy (100% 🤣), friendship, passion, family, love, romance, caring neighborhood. This drama gives me vibe of reply 1988. Almost every episodes made me laugh like crazy n when they say RACKET.. SoÑYonGdaåN 😂 also there are very touching scenes which made me cry n moved. I'm definitely gonna rewatch this again lol. It's nothing to with reviews coz I watched with empty mind n I don't regret it. It's beyond my expectations and teen fun therapy. You can give it a try without any hesitation n I bet it won't let you down. I can say that this is the best drama of 2021 after Vincenzo!",positive,"Comedy, Drama, Sport"
tt14482414,"This drama is the best show I've ever watched. It gives me comfort and something to look forward to. Despite the issues, no one change my mind because it still is a good show nevertheless :) It does not only revolve around playing badminton but it also gives the viewers some life lessons about friendship, family, relationships, teamwork, trust, courage, and love. 10/10! Fighting! <3.",positive,"Comedy, Drama, Sport"
tt14482414,"Everything is good about this drama. How characters are written, the plot and story, the way they have shown social issues. Every good thing are gathered together to make this drama a beautiful series wich is one best I've seen this year.",positive,"Comedy, Drama, Sport"
tt14482414,There are the definite haters. They give it unfairly a low score. The series is great. The characters are lovable and the story is wonderful. They pull at your heartstrings.,positive,"Comedy, Drama, Sport"
tt14482414,"Hey you guys, who came here just to drop the rating of this drama, stay away from us. You haven't even watched it yourself, and you only know from what other people have said. Don't blame the cast of this drama, because the main characters are children. So, please watch it yourself, enjoy the drama, if you don't like it just shut up and don't incite others to vilify. I personally like this drama. 👍🏻",positive,"Comedy, Drama, Sport"
tt14482414,Very rare will you get a sports drama where even the side characters have full back stories and character development. Ignore all the hate on ill conceived notions of disrespect and judge for yourself... (a fictional genius that beats everyone by 10 to 15 beating someone from your country by that margin is not disrespectful. It's consistency.),positive,"Comedy, Drama, Sport"
tt14482414,Its being bashed for racism but I didnt even notice it. People are saying they criticised the inodnesian team beacuse in the drama in the abroad game the indonesian team was petty dude its just a sub story plot .they also talked about japan and 90% they criticised koreans .were they suppose to make imaginary countries for this -_- don't listen to butt hurt hater they didnt even fonish the drama.,positive,"Comedy, Drama, Sport"
tt14482414,"Thanks for all casts a lots. Give me an unforgettable summer, when I have children later, I will show them. Now, I will introduce to the people around me, helping them to feel this summer to the fullest. Trust me this is truly one of the best drama I have ever seen.",positive,"Comedy, Drama, Sport"
tt14482414,Such an amazing and well written storyline. The characters are so lovable and you can't help fall in love with them. How they navigate the challenges they face not only in sports but also in the korean society. How they never back down and stands by their principles is inspiring and you can't help for rooting for them. A perfect drama for the entire family that leaves you with a good feeling after watching.,positive,"Comedy, Drama, Sport"
tt14482414,"Racket Boys is 2nd Korean drama I've watched in 21 years. Actually, I don't watch Korean movies very often, I accidentally got some free time because of the epidemic, so I watched it. This is a best series with excellent script, actors with good acting. There are scenes make me think a lot. The plot is built with depth, I can see myself through the character, which leads to a good connection with the character. I would be happy if there is a season 2, the story of Hae Kang and his friends in the high school environment. In short, this is a drama that everyone is worth watching.",positive,"Comedy, Drama, Sport"
tt14482414,"I love it, the friendship, the moral lesson, and also the scenes where they played badminton were always entertaining and thrilling to watch. I can see that the casts practiced hard on badminton, and it's really nice to see that. And I also like all of the OSTs, They suits the drama very well. It's kinda dissapointing that there is a scene that sounds kinda disrespectful to another country. But if we don't include that in this talk, then this drama is 10/10 for me.",positive,"Comedy, Drama, Sport"
tt14482414,This show got me hooked. It is not boring and very exciting. The show is suitable for the whole family to watch.I do not think this show deserve a one rating.,positive,"Comedy, Drama, Sport"
tt14482414,"Am surprised that the show is getting rated so low here. I haven't finished watching the entire series, but it is funny and inspiring so far. Of course it's not a perfect drama, the biggest problem may be that all the players are not trained properly, they play badminton not even close to the decent amateur level. Other than that, I appreciate the illustration of people bonding together, such as families, teammates, neighbors, etc.",neutral,"Comedy, Drama, Sport"
tt14482414,I'm shocked with the bad reviews here. Overall it's a good drama. I've seen the director's previous and ongoing works and it matches! I don't get the hate just because of 1 episode 🤷‍♀️,positive,"Comedy, Drama, Sport"
tt14482414,"You need to watch this series. I love it so much because it portrayed about friendship, hardship and family 😍Most of the reviews here are biased. True, there is this one EP that may have offended some viewers from a country. It's a basic thing in any sports, booing when in a game is actually quite common yeah guys.Anyway, show some sportsmanship man. I bet they only watch that one scene to do a bad reviews instead of watching the whole series. Truly infair yeah.",positive,"Comedy, Drama, Sport"
tt14482414,Drama is too good. Story line is also good. Nothing wrong with the drama except that one mistake otherwise nothing lacking to get 10 out of 10.,positive,"Comedy, Drama, Sport"
tt14482414,Nice drama with good story line despite the controversy. Depicts good diversity from each characters and character development is so far so good.,positive,"Comedy, Drama, Sport"
tt14482414,"Amazing young actors and actresses! Story about family meaning, friendship, sport, first love...",positive,"Comedy, Drama, Sport"
tt14482414,"I really really love this drama, from the beauty of Haenam, from all the boys and girls from this place, from the help of all the people from Ttangkkeut village, i still don't understand why producer put Indonesian people as a bad viewer, just that, everything is perfect, from the scenery to the color of the movie, through this movie i know everyone will have a lesson for themself. Anyway, love you Racket Boys, hope you guys will make another season 2 soon.",positive,"Comedy, Drama, Sport"
tt14482414,"Such a beautiful series it is.. as someone mentioned in the review it was a ""breath of fresh air"" , Idk why the rating is low but I loved each and every character and storyline is beautiful.I really liked how there was so much understanding between boys, how they respected coaches/elders, bonding between village people, birthday celebration for great gran, going to other granny's house just for WiFi and especially how granny loved it when children came over and cooked meals for them, how city people and village people helped each other, how the boys just followed what they loved without giving much thought.It is indeed a breath of fresh air and slice of life.",positive,"Comedy, Drama, Sport"
tt14482414,"Very enjoyable show. Felt like a sports anime. Also breaks fourth wall at times. Funny also.Reason got a bad rating mentioned another country and they got salty and rating bombed here. If you want more information just google ""why racket biys has low rating"".I find it absurb these kinda of ratings are allowed.",positive,"Comedy, Drama, Sport"
tt14482414,"Absolutely loved this coming of age.. everything about this KDrama is just perfect. The characters, the storyline, the first-teenage love. The characters are from all walks of life and going through their own dilemmas! The casting is perfect, and everyone's acting is top class. This show will take you back to your days of teenage innocence when it was all about having fun with friends. I am shocked it's got 4.6 rating on IMDB. It deserves a 10/10. It's as good or even better than descendants of the sun, Itaewon class, Guardian: the lonely god, and other famous K-Dramas. It's a must watch for teenagers, and adults alike.",positive,"Comedy, Drama, Sport"
tt14482414,"I personally liked this drama so much, it has good re-watch value too. Such young actors pulled off these tough scenes. Kudos to them. The story was so wholesome, exactly the kind like in hospital playlist, prison playbook and reply series. The comedy was great too.",positive,"Comedy, Drama, Sport"
tt14482414,My family enjoyed the show. There were funny scenes and heart lifting scenes. Kids acted well and we had a good time watching the show. Badminton is not popular here in the US but it is an affordable sport so lots of ppl on Asia play it :),positive,"Comedy, Drama, Sport"
tt14482414,"I really loved this series.. Seriously i have no idea why imdb rating is this low.. But belive this is one of my favorite series.. The love between parents, friends, neighbors, siblings it had shown everything and i am really impressed of each and every character to be honest i am really attached to every character. It made me laugh, cry, excited, angry emotional rollercoaster though.. And to be more exact it made me envy cause i don't have that type of friends.. This is something that i'll recommend each every youngsters over here.. Cause in our generation the most important thing we lack is true friends and ofcuzz self confidence in this series they'll show every sort of things like that.. I don't know why this series getting so much of hatred because of this hatred so many people not acknowledging this kind of drama. And they show the most important thing is love for a passion. How can a person turn into this passionate when they love to do something.. I really got so many lessons watching by this drama.. And i really really recommend this drama to everyone.",positive,"Comedy, Drama, Sport"
tt14482414,"THIS IS ACTUALLY MY BEST BEST BEST EVER DRAMA I HAVE WATCHED! I love the vibe the series gave off, the main thing I like is their friendship and how the friend group stay connects.In ep 5, I personally think the reason they choose Indonesia is they know how spectacular Indonesia's badminton is. They want to say that Indonesian is amazing but Seyoon's hard work and efforts paid off.The series also clearly shows how Seyoon an international badminton athlete. So they must choose a country to be against, so they choose Indonesia as their opponent due to how good Indonesia is at badminton.",positive,"Comedy, Drama, Sport"
tt14482414,"This drama gives us slice of life concerned with countryside and badminton. You, writers and directors have given us so precious information about badminton that I have an idea to try badminton in free time. I also heard all the actors are chosen by casting, so they are so real, especially Yoon Hae Kang. We, fans from Myanmar, are waiting for Season 2. Hope we can fulfill our hopes🏸💙",positive,"Comedy, Drama, Sport"
tt14482414,I really love this drama. Thanks for your amazing creating script writer!! I like all the stories you write. Please create more like this. I'm waiting for Racket boys S2.,positive,"Comedy, Drama, Sport"
tt14482414,"Delightful drama to watch, some scenes portrayed the reality of as a team traveling to other countries and faced difficulties.",neutral,"Comedy, Drama, Sport"
tt14482414,"Literally such an amazing show. People are just mad because of ""racism"" when its not even that serious loll.. people only gave this show a bad rating because they are overly sensitive.",positive,"Comedy, Drama, Sport"
tt14482414,"Great storyline ,great cast..
I think there should be season 2.",positive,"Comedy, Drama, Sport"
tt14482414,"This drama is so pure and heartwarming ,Please don't evaluate this drama based on a few episodes since it is very genuine and wonderful. This drama deals with issues on sports, society, the environment, family, friendship, and curriculum, among other things, and finishes with a lovely homely vibe.",positive,"Comedy, Drama, Sport"
tt14482414,"I love Kdramas and after watching several romance, fantasy and action-packed shows, I am glad I found Racket Boys! It's so wholesome and fun to watch. Perfect blend of drama, comedy and feel-good scenes. I can't help falling in love with the characters.",positive,"Comedy, Drama, Sport"
tt14482414,"This show is really,i am enjoying this,i don't get why the rating are soo low, idk about the badminton in skorea but the show is only for entertainment purpose and it i guess there is no relation with reality!!!the rating doesn't do the justice with the drama. Believe me this show real good.",positive,"Comedy, Drama, Sport"
tt14482414,"This drama will give you that warmth like when you're watching reply1988 or Prison Playbook. The comedy also spot on. Such a cute and fun drama to help you relax from your hard monday and tuesday routines. Keep the good job, Racket Boys Fams. Thanks for promoting badminton.",positive,"Comedy, Drama, Sport"
tt14482414,I am liking the series so far.Very heartwarming and there are lessons given every episode.Such a good feel show. The cast are adorable especially the young girl.,neutral,"Comedy, Drama, Sport"
tt14482414,"I absolutely loved this drama! I just finished and already miss the family. A pure, heartwarming, beautiful story about the joys and downfalls of sport. It was great to see something different that didn't involve your typical love story or all the dark stuff that's been out lately. Each of the characters brought something to the story, and the cinematography was amazing. You will laugh, cringe, get upset, and definitely cry your heart out. I recommend a hundred percent to anyone wanting to watch. Just do it!!I also don't know why people are so upset with it and giving it lower ratings. I watched and it wasn't that big of a deal. It's just fiction and y'all crying over nothing. There's real racism happening to the people of West Papua in Indonesia, so unless they're free, then I'm not listening to you prideful lot talk about unfair treatment.So yes, please give it a chance and watch. You won't regret. Also, FREE WEST PAPUA from Indonesian rule! Thank you!",positive,"Comedy, Drama, Sport"
tt14482414,"I'm really loving this series. There is no major trauma or drama, it's just a bunch of middle school age kids (15 or so years in age) who love playing badminton.Yes they have challenges, and various family situations, but ultimately it's a series about a group of kids learning to become a team and celebrate their own strengths.Each of the characters have a unique personality, and the young (and not so young) actors do a really really great job bringing them to life.It is a lovely show to watch and you can be confident to share it with other people in the family.EDIT: I'm in NZ, so found the scenes supposedly set here a bit ridiculous - but not offensive in any way!",neutral,"Comedy, Drama, Sport"
tt14482414,Not so complicated and make my mood up when watching the drama.,positive,"Comedy, Drama, Sport"
