imdb_id,review,rating,genres
tt16549178,"All participants in this drama, both actors and directors, understood that in making such a decision, there is a huge risk of injury and death of the animal. Apologies are easy to say, it is impossible to restore life to a living being. Drama cancellation and litigation is the perfect solution for all of them. Cruel, but deserved.For such a company, using computer graphics is not a problem at all, but it is clear that someone is especially greedy and continues to exploit animals for their stupid purposes. The question is, how many such projects were there before this drama and how many animals were harmed on their set for the sake of a few ""spectacular"" minutes? An animal died, footage of animal abuse was included in the episode, and the film crew just apologized .. do you think this is normal??",negative,"Drama, History"
tt16549178,"I don't think this show deserves to see the light of day. It wasn't worth the animal abuse that they condoned for a short shot in the show. Not only did they tie a real horse up and force it to land on its head, but the horse unfortunately died shortly after. If you're considering watching this show... don't. No show is worth the torture and death of an animal, especially not this one. There are many dramas that follow this unoriginal plot like this one that don't partake in cruelty like this.I hope this show gets cancelled, and they people behind this suffer the consequences.",negative,"Drama, History"
tt16549178,Don't support animal abuse in films or any other form of entertainment. The poor horse involved in this film endured horrific treatment which led to the unnecessary death of this innocent animal. They actually wired the horses legs together to make it fall and killed it. This is just beyond belief. Why was this allowed to happen? This is not entertainment.,negative,"Drama, History"
tt16549178,"Watch behind the scenes. See how few of the set guys hold the rope and kill the horse in the set. Imagine, you have one job, its easy, to help the production, and you have brain as well. You know that what you are doing will kill the horse, and you are killing a horse with your own hands. I wonder the psychology of the authority who decided this. No movie set should have the courage to kill an animal.",negative,"Drama, History"
tt16549178,"The tv series itself is great. It's like a Korean Game of Thrones - many characters and parties fighting for the throne, each has bad side and good side. Complex characters, great writing and storyline. It's like the dark truth of history, not a fairytale-like story like many other historical kdramas. This is definitely the best Korean tv show I have seen!All the complaints and bad ratings are because of the animal abuse scandal. One horse died during filming, sadly. While this is very unfortunate and I hope the responsible ones were fired and the necessary actions were taken to avoid such abuse in the future, I don't think it has anything to do with the quality of the series itself. There were probably a few production workers who work with the horses, they made this terrible mistake. But there are hundreds of others, innocent people, who work on this production! The great actors, the script writers, the costume designers, the set designers, the cameramen, etc! Don't degrade their work too just because a few others made that terrible mistake! It's as if you canceled the great movie The Pianist because of the director Polanski's scandals. You can't cancel or degrade a whole production, which is the great work of hunderds of good people, because of the scandal of a few people.",positive,"Drama, History"
tt16549178,"In the 21 century,to not use the computer graphic,and still kill an innocent animal...I can't believe. That was the last straw. I'm looking for watching Cdrsma from now on. I can't believe in a high developed country as South Korea ...😳👎🏻👎🏻",negative,"Drama, History"
tt16549178,"The series was great. Every episode of the series was wonderful and exciting and the actor of the main character ""Joo Sang Wook"" was great in it. His acting was very cool and impressive and I liked him very much. His facial expression and acting in different scenes made me think that he is a versatile actor. He's a really talented actor. Definitely, he's been in the industry for so long, but he's still able to deliver amazing performances.And about the story of the series, because it was completely based on Korean history and historical facts, it was very attractive and exciting to me.It was such a touching series
Thanks to all the creators of this series.",positive,"Drama, History"
tt16549178,"All actors and crew know animals are killed to make this show. Just look at the poor video of them killing a horse for just one scene. Purposefully tripping it. It died a week later, but looks extremely injured so therefore it must have suffered for a long while. This show needs to be banned and and all participants jailed or fined. Disgusting.",negative,"Drama, History"
tt16549178,The show overall is tasteless. It's not only tasteless but they killed a horse while filming. Absolutely terrible. Whoever came up with the idea to tie the horse should get fired and should go to jail for animal cruelty. Disgusting.,negative,"Drama, History"
tt16549178,"It might have a decent story line but I will never know because I will never watch something that chose violence, abuse and neglegence of an animals welfare for a mere scene. I am an avid fan of Korean production but this is just far too much...",negative,"Drama, History"
tt16549178,"I totally agree with rkpmthk's observation. I really wanted to see this and I started watching it at a Korean friend's place - couldn't continue. Animal cruelty is the most abhorrent thing to me and this just turned my stomach; then again, I suppose I shouldn't have been surprised.",negative,"Drama, History"
tt16549178,"Hi Angelique, and whoever supports this show and the ones behind it, if you consider killing a horse on PURPOSE is a mistake, then you're no less as sick and disgusting as the perpetrators who commited this vile and awful act.Kami had his legs tied up with wire, several people pulled on those wires as soon as he started running with the sole purpose of tripping him, Kami ended up falling (as they wanted) and breaking his neck, nobody there cared about him as he lay there in what I would imagine was excruciating pain, he died a week later due to his injuries, they killed him for entertainment, he was only around 5 years old, he still had 20-25 years ahead of him, but they killed him on purpose for what? A couple minutes in a TV show?Btw this was not the first time KBS had done this, this is just the one that they were caught red handed in doing, so no, this was not an accident, a MURDER was commited, and your cold heartedness in supporting the murderers really shows what kind of evil you are.",negative,"Drama, History"
tt16549178,The prior review by angelique says everything I think about this complex intelligent work of genius. I have seen probably 40 Kdramas of which most have been excellent. With gorgeous boys (thank you!) and gals. And clever tricks.This isn't that. It's deeply serious with no easy answers about who is good or bad. It's a very complicated story that will demand your attention. Don't miss it.,positive,"Drama, History"
tt26770113,"At first I thought this will be a horror series. Like a proper fictional story where there is a zombie outbreak but it is already been tamed (much like the end of shaun of the dead) and these characters join this game show where the have to do challenges while also escaping the zombies (basically squid game but with zombies). And it'll be shot much like we are watching a reality show.But alas, the show is basically just role play.Knowing these people are actually safe made it hard to believe in it. As well as them unable to truly hurt the zombies (since they are just real people), makes the whole thing kinda stupid (not that I endorsed violence but it is like watching people do tag and run but with zombies).Dex is the star of the show for sure, but it also made the others looked incompetent by a lot.",negative,"Comedy, Game-Show, Horror"
tt26770113,"Interested in watching this at first because it said to be unscripted like a reality show but this is probably 98% scripted like a comedy zombie drama.There's this scene where all the cast inside a van tried to escape from the zombies, and they hit a zombie with the van and they're all passed out inside the van from the impact, all 6 of them passed out LOL
This is so far from being a reality show hahahaDex and lee si young are adorable thou!Solid effort for all their acting,
Would actually so much better if they do it inside 1 big shopping centre without any script like survival show.Overall worth watching if you want a little bit of laugh.",neutral,"Comedy, Game-Show, Horror"
tt26770113,"I watched the first episode, I like the starting point, all make sense, love the action which add up more action element vibe like a real apocalypse. Second episode also good, all make sense, like the thriller it gives etc. The ending quite questionable but understandable.But the third episode made me stop watching. Like it just doesn't make sense, like, how come one person can fall down, being pulled by a bunch and still not getting bitten? This is still acceptable since im her fan as well, but the fact that that other guy who could just climb the tower over and over again, couldn't jump over that short thingy like???? Hello? It just doesn't make sense. The scene is so obviously dragging like everything drags just to ensure the one should die, dies, and the one who shouldn't die survive. Plus, isn't both second and third person in both episodes DIED due to the same reason? Like come on, it just quite repetitive and doesn't make sense man.",neutral,"Comedy, Game-Show, Horror"
tt26770113,"A zombie reality show in a so-called ""unscripted"" setting is a recipe for disaster. I couldn't take it seriously when it was painfully obvious to me that the cast were just acting like they were seeing zombies in real life saying ""they'll die"" and stuff like that. It felt like the show was belittling my intelligence. And it also made the zombies acting seem fake and not scary.I can't believe Netflix halted production of a brilliant series like All Of Us Are Dead season 2 and also Kingdom 3 for this, just because this reality show needed the zombie art and choreography team of the former 2 shows. Netflix should better stick with producing zombie fictious series like AOUAD which has proved to be one of the best in the world.",negative,"Comedy, Game-Show, Horror"
tt26770113,"Lets be honest, South Korea produces the best zombie shows and movies. As a huge fan of the zombie genre I spent no time downloading the whole show on netflix so I could watch it on my vacation. I spent the first 15 to 30 minutes figuring out what was going on. I completely lost it when they mentioned it was ""unscripted"". Sure there was no script to follow but the whole show was made to look like a reality show where the characters have no clue what is going on when it is very obvious they are in on the show. The very convenient cut between the episodes gives them enough time for makeup and prop setup. Now I was stuck on a vacation with nothing else to watch except for this. The more I watched the more I felt I was losing my braincells. There was nothing to look forward to. The characters are real life celebrities that had nothing to offer. There were no stakes. Just a bunch of fake zombies, and fake characters.",negative,"Comedy, Game-Show, Horror"
tt26770113,"They could have just tell the contestants that they are surviving a make believe zombie world and inform the viewers that they are participating in some quests with ""zombies"", rather than lying to the viewers that no information is given and making us believe any of this is unscripted(I hope for anyone's intelligence nobody actually believes this).It's painfully obvious when the contestants are pretending to be terrified while the production crew continues to film them in camera close ups and continue to keep audio in check literally a few feet away from them, this show is an insult to any viewers intelligence.If you wish to sate your curiosity to find out how stupid all these are go ahead, but I can almost guarantee you that you will drop this show within the first 30 minutes.",negative,"Comedy, Game-Show, Horror"
tt26770113,"I like many of the Asian shows on Netflix. But not this one. Supposed to be unscripted, that is the most unbelievable part of this show. Abysmal dubbing. Terrible acting.The escapees need fuel. They stop at a gas station and the driver gets out to refuel. Zombies appear and attack the driver. The cast, inside the un-fuelled vehicle, work out that the zombies react to sound. They decide to get out of the vehicle to throw articles around on the forecourt. Oil cans, water drums, bins etc. This should draw the zombies away from the vehicle making it possible to fuel it. Each person that throws the items, to draw the zombies away, run around screeching and screaming. Why would they not just throw a trash can, shut their mouths and move on to the next noisy item ? Pure idiocy.By now, in episode 1, I had really had enough of the terrible dubbing, camera work, and acting.Please let the zombies win.",negative,"Comedy, Game-Show, Horror"
tt26770113,"Netflix has abandoned some really good zombie series over the past few years, but they come up with this trash now.You seriously need a low IQ to enjoy this. Case and point:The bad guys lock up a girl in a cage by just shoving some zombies around, but the good guys need a ridiculous plan with an RC car to free her.At another point the ""reporter"" character is shown in front of a wall of firearms (AK's and AR's), yet he proceeds to train the good guys on how to use a ""potato gun"" instead.I don't know what they are thinking. They have some great zombie series that they just dropped and expect us to like this. Give me more. Daybreak, All of us are Dead, Black Summer, and Sweet Home instead of this brain dead garbage.",negative,"Comedy, Game-Show, Horror"
tt26770113,"This was a great idea and the producers were clearly did their best. First, the good points, and there are a number of them:1) Zombie effects were done quite well. This makes sense since it was apparently the same team as ""All of Us are Dead"" (hurry up with the next season!)2) The storyline -- clearly difficult with an unscripted show -- was done really well, and the producers were clearly thinking cleverly while shooting went on to react to events and finished with a neat little denouement.3) Some episodes' challenges were good and realistic for a zombie scenario -- finding items, rescuing survivors, finding working transport, etc., were done well and they were able to put little wrinkles on it with the unscripted nature that a scripted show would not have had.4) Each contestant's character showed through their actions and narrative subtitles. This was good at inspiring fondness for some characters and dislike for others.5) The contestants were clearly immersed enough to do things which hold some actual risk. Not hugely dangerous, but think things like jumping over barriers and climbing fairly high objects without nets/wires/etc., and ""fighting"" zombies (no stabbings or hammer strikes to the head, but definitely hard pushes, throws, etc.).6) Tsuki is adorable.Now, the bad points:1) Obviously all the contestants knew they weren't in an actual zombie situation. Most were still able to act as though they were, but Rong-Chul in particular could not suppress a grin even during scenes that should have been intensely terrifying (well, except one that seemed to really shock him). Additionally, sometimes many of the actors were either overcome by silliness or made decisions they quite clearly would not have made during an actual zombie apocalypse.2) While many of the challenges were pretty good, a couple of them also got into some silliness. Quiet (nonzombie) portions of the show also looked a lot more like variety talk shows than any kind of drama.3) The survivors all being celebrities at themselves was a bit weird (at one point, a survivor even asks why there were so many celebrities clustered into the same country grocery store). It was even weirder when they tried to use their celebrity status to convince others they were trustworthy.4) The presence of ""NPCs"" who served to guide events was a bit distracting. Early episodes handled this pretty well to do the initial setup, but some of the later NPC interactions were sort of blunt.Overall, I enjoyed the show, though, and would look forward to another season.",neutral,"Comedy, Game-Show, Horror"
tt26770113,"Man!! I was so excited to watch this series. I literally waited a whole month for it to come out and now since it came out oh my God it is the worst webseries I have ever seen in my whole life. The camera keeps on turning left and right and it looks so fake. It looks nothing like a webseries of 2023 I am so disappointed I can't believe why Netflix would even buy these kind of webseries when they know people just gonna, give zero ratings so I suggest you don't waste your time. Thank you. I hope somebody from the movie is reading all these reviews and they can try to make a better movie or a web series next time. Better luck next time.",negative,"Comedy, Game-Show, Horror"
tt26770113,"A few episodes in, and i like this somewhat improvised reality show. From their reactions, etc., it seemed to me the contestants were told they'd start out being on a reality dating-type show but that ""something"" would happen and they would then be on their own.I can't imagine that this is any more than minimally scripted, because the producers obviously spent a lot of time setting up the various locations and situations, and it doesn't make any sense that they would do that for people who are just reading lines. From their reactions as the dating show starts to go sideways they seemed genuinely taken by surprise.The ""something"" turns out to be a zombie apocalypse, which they are supposed to somehow survive. They travel around together to complete various escape-related tasks (and try to avoid being taken out by the zombies). You can also tell the zombies are really into the concept.For imported shows like this, i much prefer the original audio accompanied by subtitles. The voiceover is kind of bland, and doesn't really match what was very likely more honest reactions to what's going on. Would recommend for fans of reality (and, sure, zombie stuff too)",neutral,"Comedy, Game-Show, Horror"
tt26770113,"This show is funny and ridiculous. These people are so stupid. Fukutomi Tsuki is super hot and worth watching for her. But seriously they are so stupid. They said for example in the first episode pumping gas you have to hold it. Yet if you look at the handle you put the metal part down and the handle will pump itself. The guy making noise is an idiot because he didn't bother getting the key for the car first. I mean seriously this is hilariously stupid. But that's what it is supposed to be. It is supposed to be a stupid reality show where zombies are real. I love how they put digital things over the heads of zombies and people. It makes it like a crew is editing everything as it is happening like a real reality show.If zombies did happen you never let the child bearing women risk their lives. You have to eventually populated the world. Doctors, nurses, vets, engineers, farmers and people who know a ton about everything are all the most important people in a zombie apocalypse. The sound guy not so much haha. But seriously never make the child bearing women out their lives at risk. However everyone does need to pull their own weight and help the group.These people are utter idiots. It's not hard. The grocery store episode for example. You simply block the doors with chains, rope or carts stacked up. Then you clear the store of zombies. Then you are perfectly safe and they don't have to sneak around like idiots and trying to decide who to pair up with. Just utter idiots. Block the doors then gather the stuff. Simple not hard. If you have any brains at all you will survive a zombie apocalypse. Stupid people are the first to die.The one thing that annoys me the most about this show is they are so stupid. None of them get weapons. They had bolt cutters but then left them. They had tons of opportunities to get weapons but they simply don't. I mean seriously this is why they are losing people and getting caught. Also NEVER drink from someone you don't know. Or at least have two people not eat and drink for a few hours first. Eat in shifts. But seriously weapons are bats, hammers, anything blunt or sharp. I mean the bolt cutters are a weapon. Scissors are weapons. Hammer is a weapon. Heck a broom handle is a weapon and you can duct tape a knife with it. Seriously always have a weapon and armor if you can. Even wearing multiple layers of clothes can help. Especially leather and denim. Hockey or football gear can help.The show is funny but seriously it is super frustrating because they are just so stupid. When they walk together because their legs are tied up is ridiculous. Why didn't they take the rope and tape off of themselves. Also the barn with the zombie grandma just burn the place down with the candles it would have given them all a massive distraction. It's just so ridiculous how they all haven't died yet. The only one who would survive is the special forces guy and the sexy model should also live. She can help repopulate the planet haha.",neutral,"Comedy, Game-Show, Horror"
tt26770113,"As soon as it was released, I rushed to download all the episodes at the same time. After watching the first fifteen minutes of the first episode, I regretted wasting my wifi on it. Even if this was some sort of game and the contestants were improvising their next moves, it was horrible.The contestants were annoying. (Unnecessary screams, laughing even in serious situations, keep attracting zombies.)
Bad quality and production. (The same scene would repeat three times in different angles.) Which was also annoying.To be fair, I would give episode 5 my best review. It was the only episode that I enjoyed and the only hilarious episode that made me laugh. So yes; look forward to it.",negative,"Comedy, Game-Show, Horror"
tt26770113,"I know it's meant to be shot like a cheap reality show but this makes those seem like Oscar winning cinematographer shot it.The actors are annoying as hell and I wanted none of them to survive from their first introductionsThe dialogue is supposed to be improvised but it's repeated over and over again and nobody can seem to say anything with convictionAvoid this at all costs. Just boring , dull and a waste of time.The rest is filler
Boring
Boring
Boring
Boring
Boring
Boring
Boring
Boring
Boring
Boring
Boring
Boring
Not boring , just kidding it is.Boring
Boring
Boring
Boring
Boring
Boring.",negative,"Comedy, Game-Show, Horror"
tt26770113,"I can't even watch past 30 min, my head is so painful because of the camera keep turning here and there, and the contestant is screaming here and there so loud, then my head hurts. To be frank is the worse zombie show or reality show I have ever watch... I was so excited to watch this before it air.. now I'm disappointed.. I am watching with my husband until he told me shall we stop, cause is very lame, I say ok. Let's stop here. I think I am better watching some other drama than watching this, quite disappointing, i don't find it funny too maybe I'm not a fan of reality show, it is very lame.",negative,"Comedy, Game-Show, Horror"
tt26770113,"This might be the worst TV show I've ever seen in my life. Who on earth would want to watch a group of random idiots pretending to scream and cry for 8 hours? People complain all the time how these reality shows are scripted, but we are supposed to believe this zombie crap? This is so stupid I feel like it should be taken off the streaming platform. Watching something this cringe really does make you physically uncomfortable. I don't know how anyone could make it past 10 minutes of this garbage. What's really sad is that a show about scaring people with zombies could have been amazing, so I'm confused why they didn't do that instead.",negative,"Comedy, Game-Show, Horror"
tt26770113,"It hurts the money invested in this series is the worst zombie reality series I've seen in chapter 2 I said no more..
I wanted to give it a chance but it's going very very sad and boring this very bad series..
how can netflix cancel we are dead to produce such a bad series (zombierso).. Please, I hope they do not produce a second season since it is very bad in terms of acting, the plot of the series, the zombies are not zombies, it is very badly acted, The degree of acting is so bad..
they should release another type of zombie series, this is not dirty, what they do is waste time..ATT: defender and lover of the zombie apocalypse.",negative,"Comedy, Game-Show, Horror"
