imdb_id,review,rating,genres
tt26770113,"Every character, zombies included, had a radio and battery pack on the back of their belt visible throughout the entire show. It makes sense the main characters, thinking they were on a TV show at the start, may have had an excuse to wear one but the zombies? How did the main characters not see and comment on that?Most characters were wearing a jacket or something baggie to try and hide it, but when you watch the so-called zombies stretching, trying to reach someone on top of a car, they were clearly visible.I wanted to believe and get sucked into the story but couldn't find any way to invest in this show once I saw that. I can't go higher than 2/10 = cringey!",negative,"Comedy, Game-Show, Horror"
tt26770113,"Lets make one thing clear, THIS is a game show, this is not an epic story with high stakes, no, this, is a game show. The survivors are contestants, you lose when you die. Those are the stakes.I dont BLAME ANYONE for thinking otherwise because the show does a terrible job of presenting this fact and i had to look it up because i was confused. It also doesnt help that the actors aka the players, i THINK were encouraged or told to make characters out of themselves, to try and have a story going on of their own making,This is where i think the show messes up, its trying to have a cake and eat it too, they dont play it straight enough. All this has is a psuedo narrative dissonance where the show acts like this is a real drama, but then the contestants are laughing smiling another moment. They really should of just dropped it. Have the only story being setting up the scenario in question, and treat it like a 100% game show.That being said, as a game show it is pretty neat, theres very little guidance meaning the players basically get told the objectives, and work everything else from there! Sometimes not even that and have to figure out the objectives on the fly. Turning some of the scenarios into zombie flavored escape roomsHave your finger on the fast forward button when you get bored of the fluff, and just enjoy a neat lil game show.",neutral,"Comedy, Game-Show, Horror"
tt26770113,"Casts made it a cheap reality show. If they were to truly face zombie apocalypse, they won't even survive for an hour. From the first episode, they all were wasting energies running and screaming while accomplishing simple quests. They'd have die of exhaustion from all those running and screaming around in real situation, if not from zombie bites. That's not how you survive an apocalypse. If the show was really unscripted, then I'll have to say they are the dumbest surviver ever with lowest iq. It was really frustrating to continue watching.I'm giving it 2 stars because there were some rarely funny moments I enjoyed. But overall it'll feel like waste of time.",negative,"Comedy, Game-Show, Horror"
tt26770113,"I gave it an 8 mostly for DEX (fans of DEX know who he is) and for comedy value as I found it extremely funny from the very beginning. It can't be serious but I've seen some great acting amongst the zombies - it is advertised as unscripted per se, but we all know it is fake so it comes out as hilarious. The one actor contestant with the hat with the ear flaps is laughing the whole time - even he can't help it. Dex is playing his cool self as usual and figures out how to escape the zombies in an early quest using his UDT soldier experience. Am kind of wondering if it isn't treated kind of like a mystery dinner where each contestant is given their roll to play in advance, but there is no script. Have no idea about the producing but each episode is a different quest (gas station, grocery store, etc). Will have to see how this ends - 8 episodes in all.",neutral,"Comedy, Game-Show, Horror"
tt26770113,"It was silly and funny to watch. I actually came here to read reviews because I was really not sure about it. They way the promoted it, that the contestants didn't know made me scoff, because if they were going to fake it and really scare people like some elaborate prank, some of those zombie actors would be dead. Seriously, I have watched enough zombie shows that I would weapon up because I'd need to. And then there were rules?One comment said they thought of it as a murder mystery, everyone got their rolls and then went for it. That actually put it in perspective for me and I was able to laugh and just enjoy the sillyness.",neutral,"Comedy, Game-Show, Horror"
tt26770113,"""Zombieverse is a dream come true for me! The concept of a reality that genuinely scares people, all while keeping them in the dark about what's happening, is simply amazing. The incorporation of zombies adds a thrilling twist that I find absolutely captivating. I wish I could be a part of this project. However, the authenticity is where I hit a snag. Many reality shows feel fake, and even though Zombieverse claims to be unscripted, it's hard to ignore the moments that feel staged. The fear factor falls short when the victims don't appear as genuinely terrified as someone facing a true zombie apocalypse. A fantastic idea held back by its execution.""",negative,"Comedy, Game-Show, Horror"
tt26770113,"I can't watch it for 30 minutes........
The catastrophic plot is neither tense nor realistic nor interesting, making people unable to understand what they want to express. The fake fear of the actors makes people unable to feel the real fear. After screaming, it immediately turns into a laughing scene of a variety show.The catastrophic plot is neither tense nor realistic nor interesting, making people unable to understand what they want to express. The fake fear of the actors makes people unable to feel the real fear. After screaming, it immediately turns into a laughing scene of a variety show.",negative,"Comedy, Game-Show, Horror"
tt26770113,"As someone who has watched a lot of K-shows, this one doesn't make any sense at all. It was such a torture to watch them acting like everything wasn't scripted. I get that they want it to be a mix of variety show and drama but sorry, this one is a fail. I Even Running Man is more unscripted than this one and actually entertaining to watch.Honestly, it would be less annoying if the cast could acknowledge that this a show but still put all of their effort into solving the problems and fighting the zombies, just like Running Man or Busted.I couldn't finish the first ep because of how cringy the plot and cast were. Cannot believe Netflix Korea would put out something like this and think it would be great. They could have just turned it into another zombie drama and I would totally watch it. Overall, totally not recommend.",negative,"Comedy, Game-Show, Horror"
tt26770113,"This show had a lot of promise as it was doing something revolutionary in combining zombie Apocalypse with a game show. So it is pretty confusing considering they keep claiming its unscripted but its a game show with quests but its also being filmed as if its not a game show at the same time.So the plot of this show is all these korean celebs from all walks of life such as female boxer, male baseball player were auditioning for some reality tv event but then a zombie apocalypse breaks out on set & in the town and our celeb participants are forced to try & survive together by completing quests like a game show.This would become revolutionary tv if it succeeds but sadly the things that makes this fresh n new is exactly what is making this fail. Its just to complex that even the director & zombie actors & the celebs themselves keeps confusing themselves over their own rules. A good example is that the celebs & the narrator constantly reminded viewers that the zombies are blind but they have heightened hearing & are attracted to sound. So now the problem begins cause everytime they are beside the zombies, behind the zombies & infront of them the cast would all talk & issue commands to each other but miraculously the zombies cant ever hear them lmao but then if they stood very still n lifted their arm ever so slowly n slightly suddenly the zombies are rushing them full on lol.Another issue is none of them fights back or tries to kill the zombies cause well.. unless you script the actions then u cant actually hurt the zombie actors purposely... so if u cant do kill or hurt them then that means this show is scripted & that alone already ruins n contradicts the premise of this show being unscripted.Also theirs been no mentions of needing to go washroom, or using cell phones to call for help, or even any signs of worry for their own family members back home lol so that also just contradicts openly the narrative that its unscripted. Even worse is the female cast constantly screaming is becoming so annoying... like the Tsuki chick thats a kpop singer, shes so cute but her voice constantly screaming high pitch is driving me insane, its like the equivalent of someone scratching their nails across the chalkboards. They constantly let viewers know the zombies attracted to sound but at every moment a zombie is near the female cast screams constantly as they run or try to stealthily sneak by lmao. Honestly the way they keep screaming u would think they were auditioning for some Japanese Adult Film lmao.Anyway this show is a huge fail all due to how complex they designed the plot of the show, I dont think even the zombie cast n director & the celeb participants understand fully the clear boundary lines they trying too display between :
Game show VS a fictional zombie apocalypse Vs Real Zombie apocalypse.",neutral,"Comedy, Game-Show, Horror"
tt26770113,"I simply did not appreciate what was being chased here. First, I detest reality shows in general, so when I figured out what was happening, it was a double-sided turn off...which is exactly what I did after episode 6. I gave it the ole school yard try, but labored over each episode I watched until making my decision to turn it off. Others have given synopsis about the details of how the ""show"" lays out, so I'll give some content comments instead. Notice there was no ""second.""-THERE IS NO GORE IN THIS! Ok...in all honesty, when the first episode came on, there were a couple glimpses of blood, so I thought we might be in good shape, but there is very little either violence or gore after the opening of the series. Sadly, Tsuki's screaming permeated the show, which was violence to my ears.no bad language, no drugs, NO NUDITY.If you were looking for a new zombie idea to quench your thirst, this is NOT for you. If you love kawai, kitch, and Kardashian, give it a whirl.",negative,"Comedy, Game-Show, Horror"
tt26770113,"This show could have been good had they just said the actors knew it was a show. But the whole pretense is that they don't know it's a reality tv show (as they said in episode 1 that they won't disclose any more information to the actors). Though, this is not entirely convincing when they have close ups on the actors doing some things where it is very clear that a camera would have been all up in their face AND would have taken time to do so- meaning they would have had to stopped filming just to get these close-ups... For example, in episode 1 they must fuel up their car, so someone gets out of the car. As they do, we get a whole zoom in on them from bottom-up, front and back- as if they're some sort of character in a fighting game. When the whole show is revolved around the idea that an apocalypse is occurring in real-time, the reason for watching goes outside the window once you know they're just acting. Again, it wouldn't have been bad had they just said 'Ah, the actors know it's a reality tv show, but they must do everything they can to survive'. Again too, they say that what the actors do are completely unscripted, but they are literally guided on where to go and it's pretty obvious from there what they should do. For instance, episode 2 takes place in a grocery store. Gee, wonder what you could possibly do there except for- I don't know... get food and water. I wasn't expecting much, but still. Didn't think it would be this bad.",negative,"Comedy, Game-Show, Horror"
tt26770113,I wrote this review from the experience of being zombie obsessed and watching a lot of zombie shows/ films.A lot of people have review bombed this because they didn't really understand it it seems.It's a clever concept I think: it brings together concepts from different genres of shows for quite an experimental comedy. I like how it explores ideas about tension created across different types of TV - and the way it parodies real zombie fiction from a different lens is unique and interesting.I enjoyed it overall - but it didn't hold my attention as well as it could have.I think it could have been better with a little more pacing.,neutral,"Comedy, Game-Show, Horror"
tt26770113,"This is pretty bad.First of all I have nothing against these celebrities and they are not at fault for what is happening.Basicly it is a survival game. And if you solve the puzzles you survive , and move to a different location.The premise that the participants don't know what will happen is only half true. As they have to act some stuff out to.So beacause of all the different locations and the scenarios they have to solve ithis has turned out as a huge disappointment.The puzzles are not at all interesting. And even the solutions feel scripted. This is really clear at the supermarket parking lot.The safe area is a no enter zone for zombies. But it becomes clear the zombies are instructed to wander in the parking lot and nowhere else.This should be obvious from a directing standpoint but not from a viewers perspective.There is an abundance of camera's. This can be fine in non zombie moments. But there are too many in the zombie scenes as well.There is way more to sum up. Episode 6 is probably the worst in the theme. A big part of it shooting potatoes at mannequins. At the end of the traing. They askk what's the point . And exactly what's the point...
this seems more like a teambuilding trip than a zombieseries.There are great Korean zombie series. The best is kingdom,
Sweet home and all of us are dead are also pretty goed zombie series. There are a bunch more. Some very light hearted as well.Anyway this non scripted is the worst by a country mile.",negative,"Comedy, Game-Show, Horror"
tt26770113,"People need to understand that ""unscripted"" doesn't mean that the cast knows nothing. Obviously they do know that they're in a reality show and what they need to do to survive, otherwise they would harm the zombie-actors. But their reactions and characters seemed genuine to me. I found it really funny and interesting. It is a reality show, so you don't have to question their actions, it's not a movie nor a series. Some people didn't like the fact that the cast laughed and seemed to enjoy it, but I really liked that, because it made it more genuine for me. I think that it was really entertaining and I would like to see another season with different cast!",positive,"Comedy, Game-Show, Horror"
tt26770113,"I knew almost nothing about the show before I started watching it so I didn't have any particular expectations. Zombieverse is a fun watch if you have a good sense of humor. It's hilarious at times which is what I love about it. The main reason I gave it a chance was because I'm a huge horror fan especially when it comes to anything in the zombie category. That being said, fellow zombie fans will more than likely be disappointed in this series. It's corny and unrealistic especially when it comes to the zombies and the survival aspect of the show. Some of the characters are insufferable at times but if you can get passed the obnoxious unnecessary bits, it's entertaining. There's a bit of suspense in each episode, making it just exciting enough that I care to see what will happen next. Zombieverse as a whole is pretty ridiculous but it's meant to be lighthearted and not taken seriously so if you can accept that then you might find the show enjoyable. I like that it pokes fun at actual reality shows and celebrities / social media influencers. I don't mind zombie comedies as I'm a fan of Shaun Of The Dead (a dark comedy) and Z Nation (a dark comedy drama) and both take place in a zombie apocalypse type situation. If you're watching it purely for the zombie factor, Zombieverse leaves quite a bit to be desired. If there is a second season, perhaps it will be more satisfying in that sense. I will definitely watch it if there is another season. We're left with multiple unanswered questions at the end of season 1 so there is definitely potential for more. I personally hope the show doesn't get cancelled because I would like to see where it could go. The funny moments in this series make it worth continuing to watch because sometimes mindless tv is self care but I'm also interested to see some character development. There was a similar tv series from the UK about a fictional reality show / game show that takes place during a zombie outbreak. I think it was called Dead Set or something like that. Dead Set had more drama and action. Zombieverse is the more innocent, more animated / gregarious, Korean version of that show.",neutral,"Comedy, Game-Show, Horror"
tt26770113,"If Zombies attack Korea , they won't last 5 minutes. If this is the reaction , they are doomed. Even the one who claimed to be a Navy Seal was utterly useless. I was hoping for an exciting and suspenseful series , and we got a series that was looking like they made it up as they went along. Absolutely no survival skills were to be seen , and no characters were likeable or interesting. I'm on episode four and I'm doubtful that I can make it through the series. It's like watching a train wreck on slow motion. The only reason to continue watching , is to see how incompetent they can get. The premise is good but execution is terrible.",negative,"Comedy, Game-Show, Horror"
tt26770113,"There's quality zombie movies and TV series and there's absolutely a failed zombie series you should avoid watching! Episode 2 found survivors with supposed to be a ""Navy Seal"" and he was 10x as useless as the others. This is where I stopped watching the series, I gave it about 15 minutes into episode 2 to see if this zombie series would make some type of improvement but was meet with the same junk as the first episode, truly don't want to waste more time wasting watching this series, my recommendation is, wait for the next zombie TV or movie and hope for the best cause this ain't it! It's a bummer but you'll thank me later.",negative,"Comedy, Game-Show, Horror"
tt26770113,"Idk what kind of show it is, as many dumb characters playing their role except for Dex (Kim Jin-young), Lee Si-young, and Kwachu-hyung (Hong Seong-woo). While the others like cheerleaders who like to shout in every situation in the whole show. The awesome points are in the zombie make-up, the location setting to support the stories, Dex's actions, the zombie scenes while they attack ppl, and the ship bus. Others are awful, especially the stories inside the show, as many Korean directors like to put many unnecessary dramas inside their works. It's the worst Netflix TV show ever on their platform.",negative,"Comedy, Game-Show, Horror"
tt26770113,"I was not impressed by this series at all. The writing was all over the place and it just felt so lazy. There are so many plot holes to anyone who pays attention to what's happening. Events happen that don't make sense and just overall the acting was so unbearable at times, it felt so awkward that I could barely watch. You can clearly see the multitude of times that the cast broke character, even if the script said they should laugh or not take a situation seriously, you could see how most of the cast just broke character. There were only 2, maybe 3, actors that actually felt like they were AT LEAST trying, and you can clearly see who they are if you watched the show.If you're someone that actually pays attention to the storyline, to details (big or small), easily ticked off by bad acting and character breaks, then this show isn't for you.",negative,"Comedy, Game-Show, Horror"
tt26770113,"Stumbling upon the 2023 South Korean series ""Zombieverse"" on Netflix and seeing it was a zombie-based series, of course I stopped dead in my browsing and opted to sit down and binge-watch the eight episodes. Sure, I had never even heard about the series prior to stumbling upon it by random luck.Well, I have to say that sitting through the eight episodes was somewhat of a mixed bag of nuts, because there were certainly good parts to the episodes, but there most certainly were also bad things.The storyline throughout the eight episodes was actually fair enough, and it was entertaining enough for what it turned out to be. Just don't expect the writers to revolutionize the zombie genre, and you're good to go. I will say that the storyline was actually the driving force that kept me glued to the screen throughout the entire first season.Something I didn't enjoy one bit about ""Zombiverse"" was the way that the series was presented like a computer game in certain ways, especially with the cursors beneath people and the observation symbols over the heads of the zombies. It just added a very ridiculous layer to the movie, and it didn't appeal to my liking.Then there was the acting performances, which was most certainly a very mixed bag of nuts, because some of the actors and actresses were fully and wholly unable to act properly or believable, while other actors and actresses were essentially carrying the entire show, having to drag along the dead-weight performers. The way that some of the actors and actresses kept on grinning just didn't work for me. If you were caught in a zombie outbreak with your very life at risk, you wouldn't tackle the situations with a stupid grin.And also the fast-running and super agile zombies were not something I was a fan of. Never have, never will be. And ""Zombiverse"" had a lot of those, and even had a hyper-fast zombie as well.If they are releasing a second season of ""Zombiverse"", don't expect to see me at the front row, waiting in line to secure my ticket and seating.All in all a mediocre attempt of a zombie series from South Korea. My rating of ""Zombiverse"" lands on a very bland five out of ten stars.",neutral,"Comedy, Game-Show, Horror"
tt26770113,"I have only watched 4 episodes but all i can say is, so far Na-rae is a liability, not an asset. Maybe, hopefully, this situation changes as the show continues on. Otherwise it's going to be really frustrating to watch. I actually don't have anything else to add at this point, but i still have 300 characters to go. So... How are you all doing? I hope life's been treating you good. I must say, this shows reminds me of Dead Set a little bit, which is one of my favorites btw (the British one, not the Spanish). If you haven't seen it i highly recommend that one too. Ok, I'm almost there... Goodbye.",neutral,"Comedy, Game-Show, Horror"
tt26770113,"Some fun moments and ideas here and there but overall its just pretty bad and annoying.The Bad:
-Some actors cannot decide if they are in a zombie apocalypse or in a reality-tv show. (half-assed acting comes of as bad and annoying)
-Absolutely horrible acting with annoying fake crying by some of the cast.-Being loud all the time when its supposed to be a zombie apocalypse takes away any small amount of immersion you might be lucky to find.The Good:
-Some of them are not trying so hard to act and it comes of much more fun and enjoyable.-Some of them are actually good at acting.-Hong ChulNot recommended even for the diehard zombie fans.",neutral,"Comedy, Game-Show, Horror"
tt26770113,"I have never seen this kind of jenre before Zombieverse, it is brand-new mixture of drama and reality, which makes it more immersive than any other show. It's meaningless to compare or try to define this special show, the only way to understand it is to click the watch button and just get into it! Hope you enjoy the trip to ZOMBIEVERSE, just like me :)I have a advise for those who hesitate,Don't try to figure out which scene is real and which isn't. Just be a part of itPersonally, this was the best NFLX show ever!I thnk after zbvs, every show will be boring to me, the only show that would satisfy me must be season 2.",positive,"Comedy, Game-Show, Horror"
tt26770113,"I love anything zombie and add in Lee Si Young and this was a must watch for me. Like others, I thought this was going to be an actual series not a reality show. Funny thing being I ended up really loving this show, even the ""unscripted"" moments. Really felt like I was watching a variety show with all the little quirks and moments I tend to enjoy with that type of format. I don't think we'll get another season which is to bad. With some ""tweeking"" this show could hit way more above its paygrade. Special shout out to Kim Jin-young from Singles Inferno Season 2, it was great to see him on the show as well.",neutral,"Comedy, Game-Show, Horror"
